5090-all-8192-8192-8192-sm120a.gemm.csv
Problem,Provider,OperationKind,Operation,Disposition,Status,gemm_kind,m,n,k,A,B,C,D,alpha,beta,split_k_mode,split_k_slices,batch_count,raster_order,runtime_input_datatype_a,runtime_input_datatype_b,use_pdl,enable_sm90_mixed_dtype_shuffle_test,swizzle_size,op_class,accum,cta_m,cta_n,cta_k,cluster_m,cluster_n,cluster_k,cluster_m_fallback,cluster_n_fallback,cluster_k_fallback,stages,warps_m,warps_n,warps_k,inst_m,inst_n,inst_k,min_cc,max_cc,Bytes,Flops,Flops/Byte,Runtime,GB/s,GFLOPs
1,CUTLASS,gemm,cutlass_simt_sgemm_128x128_8x2_nn_align1,passed,success,universal,8192,8192,8192,f32:column,f32:column,f32:column,f32:column,1,1,serial,1,1,heuristic,invalid,invalid,false,false,1,simt,f32,128,128,8,1,1,1,0,0,0,2,4,2,1,1,1,1,50,1024,1073741824,1099645845504,1024,14.6392,68.3097,75116.5
1,CUTLASS,gemm,cutlass_simt_sgemm_128x128_8x2_nt_align1,passed,success,universal,8192,8192,8192,f32:column,f32:row,f32:column,f32:column,1,1,serial,1,1,heuristic,invalid,invalid,false,false,1,simt,f32,128,128,8,1,1,1,0,0,0,2,4,2,1,1,1,1,50,1024,1073741824,1099645845504,1024,17.0923,58.5059,64335.7
1,CUTLASS,gemm,cutlass_simt_sgemm_128x128_8x2_tn_align1,passed,success,universal,8192,8192,8192,f32:row,f32:column,f32:column,f32:column,1,1,serial,1,1,heuristic,invalid,invalid,false,false,1,simt,f32,128,128,8,1,1,1,0,0,0,2,4,2,1,1,1,1,50,1024,1073741824,1099645845504,1024,16.0906,62.148,68340.8
1,CUTLASS,gemm,cutlass_simt_sgemm_128x128_8x2_tt_align1,passed,success,universal,8192,8192,8192,f32:row,f32:row,f32:column,f32:column,1,1,serial,1,1,heuristic,invalid,invalid,false,false,1,simt,f32,128,128,8,1,1,1,0,0,0,2,4,2,1,1,1,1,50,1024,1073741824,1099645845504,1024,14.8735,67.2337,73933.2
1,CUTLASS,gemm,cutlass_simt_dgemm_128x128_8x2_nn_align1,passed,success,universal,8192,8192,8192,f64:column,f64:column,f64:column,f64:column,1,1,serial,1,1,heuristic,invalid,invalid,false,false,1,simt,f64,128,128,8,1,1,1,0,0,0,2,4,2,1,1,1,1,50,1024,2147483648,1099645845504,512,579.755,3.44973,1896.74
1,CUTLASS,gemm,cutlass_simt_dgemm_128x128_8x2_nt_align1,passed,success,universal,8192,8192,8192,f64:column,f64:row,f64:column,f64:column,1,1,serial,1,1,heuristic,invalid,invalid,false,false,1,simt,f64,128,128,8,1,1,1,0,0,0,2,4,2,1,1,1,1,50,1024,2147483648,1099645845504,512,578.237,3.45879,1901.72
1,CUTLASS,gemm,cutlass_simt_dgemm_128x128_8x2_tn_align1,passed,success,universal,8192,8192,8192,f64:row,f64:column,f64:column,f64:column,1,1,serial,1,1,heuristic,invalid,invalid,false,false,1,simt,f64,128,128,8,1,1,1,0,0,0,2,4,2,1,1,1,1,50,1024,2147483648,1099645845504,512,581.381,3.44009,1891.44
1,CUTLASS,gemm,cutlass_simt_dgemm_128x128_8x2_tt_align1,passed,success,universal,8192,8192,8192,f64:row,f64:row,f64:column,f64:column,1,1,serial,1,1,heuristic,invalid,invalid,false,false,1,simt,f64,128,128,8,1,1,1,0,0,0,2,4,2,1,1,1,1,50,1024,2147483648,1099645845504,512,582.38,3.43418,1888.19
1,CUTLASS,gemm,cutlass_simt_cgemm_128x64_8x2_nn_align1,passed,success,universal,8192,8192,8192,cf32:column,cf32:column,cf32:column,cf32:column,1,1,serial,1,1,heuristic,invalid,invalid,false,false,1,simt,cf32,128,64,8,1,1,1,0,0,0,2,2,2,1,1,1,1,50,1024,2147483648,4398583382016,2048,56.4248,35.4454,77954.9
1,CUTLASS,gemm,cutlass_simt_cgemm_128x64_8x2_nt_align1,passed,success,universal,8192,8192,8192,cf32:column,cf32:row,cf32:column,cf32:column,1,1,serial,1,1,heuristic,invalid,invalid,false,false,1,simt,cf32,128,64,8,1,1,1,0,0,0,2,2,2,1,1,1,1,50,1024,2147483648,4398583382016,2048,56.118,35.6392,78381
1,CUTLASS,gemm,cutlass_simt_cgemm_128x64_8x2_tn_align1,passed,success,universal,8192,8192,8192,cf32:row,cf32:column,cf32:column,cf32:column,1,1,serial,1,1,heuristic,invalid,invalid,false,false,1,simt,cf32,128,64,8,1,1,1,0,0,0,2,2,2,1,1,1,1,50,1024,2147483648,4398583382016,2048,56.0179,35.7029,78521
1,CUTLASS,gemm,cutlass_simt_cgemm_128x64_8x2_tt_align1,passed,success,universal,8192,8192,8192,cf32:row,cf32:row,cf32:column,cf32:column,1,1,serial,1,1,heuristic,invalid,invalid,false,false,1,simt,cf32,128,64,8,1,1,1,0,0,0,2,2,2,1,1,1,1,50,1024,2147483648,4398583382016,2048,56.5305,35.3791,77809
1,CUTLASS,gemm,cutlass_simt_hgemm_256x128_8x2_nn_align1,passed,success,universal,8192,8192,8192,f16:column,f16:column,f16:column,f16:column,1,1,serial,1,1,heuristic,invalid,invalid,false,false,1,simt,f16,256,128,8,1,1,1,0,0,0,2,4,2,1,1,1,1,50,1024,536870912,1099645845504,2048,11.5027,43.4681,95599
1,CUTLASS,gemm,cutlass_simt_hgemm_256x128_8x2_nt_align1,passed,success,universal,8192,8192,8192,f16:column,f16:row,f16:column,f16:column,1,1,serial,1,1,heuristic,invalid,invalid,false,false,1,simt,f16,256,128,8,1,1,1,0,0,0,2,4,2,1,1,1,1,50,1024,536870912,1099645845504,2048,11.4207,43.7803,96285.6
1,CUTLASS,gemm,cutlass_simt_hgemm_256x128_8x2_tn_align1,passed,success,universal,8192,8192,8192,f16:row,f16:column,f16:column,f16:column,1,1,serial,1,1,heuristic,invalid,invalid,false,false,1,simt,f16,256,128,8,1,1,1,0,0,0,2,4,2,1,1,1,1,50,1024,536870912,1099645845504,2048,11.5822,43.1699,94943.1
1,CUTLASS,gemm,cutlass_simt_hgemm_256x128_8x2_tt_align1,passed,success,universal,8192,8192,8192,f16:row,f16:row,f16:column,f16:column,1,1,serial,1,1,heuristic,invalid,invalid,false,false,1,simt,f16,256,128,8,1,1,1,0,0,0,2,4,2,1,1,1,1,50,1024,536870912,1099645845504,2048,11.4848,43.5359,95748.1
1,CUTLASS,gemm,cutlass_simt_igemm_s8_128x128_32x2_nn_align1,passed,success,universal,8192,8192,8192,s8:column,s8:column,s32:column,s32:column,1,1,serial,1,1,heuristic,invalid,invalid,false,false,1,simt,s32,128,128,32,1,1,1,0,0,0,2,4,2,1,1,1,4,50,1024,671088640,1099645845504,1638,5.39095,115.935,203980
1,CUTLASS,gemm,cutlass_simt_igemm_s8_128x128_32x2_nt_align1,passed,success,universal,8192,8192,8192,s8:column,s8:row,s32:column,s32:column,1,1,serial,1,1,heuristic,invalid,invalid,false,false,1,simt,s32,128,128,32,1,1,1,0,0,0,2,4,2,1,1,1,4,50,1024,671088640,1099645845504,1638,5.34385,116.957,205778
1,CUTLASS,gemm,cutlass_simt_igemm_s8_128x128_32x2_tn_align1,passed,success,universal,8192,8192,8192,s8:row,s8:column,s32:column,s32:column,1,1,serial,1,1,heuristic,invalid,invalid,false,false,1,simt,s32,128,128,32,1,1,1,0,0,0,2,4,2,1,1,1,4,50,1024,671088640,1099645845504,1638,5.70983,109.46,192588
1,CUTLASS,gemm,cutlass_simt_igemm_s8_128x128_32x2_tt_align1,passed,success,universal,8192,8192,8192,s8:row,s8:row,s32:column,s32:column,1,1,serial,1,1,heuristic,invalid,invalid,false,false,1,simt,s32,128,128,32,1,1,1,0,0,0,2,4,2,1,1,1,4,50,1024,671088640,1099645845504,1638,5.32726,117.321,206419
1,CUTLASS,gemm,cutlass_simt_s8_igemm_s8_128x128_32x2_nn_align1,passed,success,universal,8192,8192,8192,s8:column,s8:column,s8:column,s8:column,1,1,serial,1,1,heuristic,invalid,invalid,false,false,1,simt,s32,128,128,32,1,1,1,0,0,0,2,4,2,1,1,1,4,50,1024,268435456,1099645845504,4096,5.37314,46.5277,204656
1,CUTLASS,gemm,cutlass_simt_s8_igemm_s8_128x128_32x2_nt_align1,passed,success,universal,8192,8192,8192,s8:column,s8:row,s8:column,s8:column,1,1,serial,1,1,heuristic,invalid,invalid,false,false,1,simt,s32,128,128,32,1,1,1,0,0,0,2,4,2,1,1,1,4,50,1024,268435456,1099645845504,4096,5.30627,47.1141,207235
1,CUTLASS,gemm,cutlass_simt_s8_igemm_s8_128x128_32x2_tn_align1,passed,success,universal,8192,8192,8192,s8:row,s8:column,s8:column,s8:column,1,1,serial,1,1,heuristic,invalid,invalid,false,false,1,simt,s32,128,128,32,1,1,1,0,0,0,2,4,2,1,1,1,4,50,1024,268435456,1099645845504,4096,5.43018,46.039,202506
1,CUTLASS,gemm,cutlass_simt_s8_igemm_s8_128x128_32x2_tt_align1,passed,success,universal,8192,8192,8192,s8:row,s8:row,s8:column,s8:column,1,1,serial,1,1,heuristic,invalid,invalid,false,false,1,simt,s32,128,128,32,1,1,1,0,0,0,2,4,2,1,1,1,4,50,1024,268435456,1099645845504,4096,5.30012,47.1687,207475
1,CUTLASS,gemm,cutlass_tensorop_s1688gemm_f16_256x128_32x2_nn_align8,passed,success,universal,8192,8192,8192,f16:column,f16:column,f32:column,f32:column,1,1,serial,1,1,heuristic,invalid,invalid,false,false,1,tensorop,f32,256,128,32,1,1,1,0,0,0,2,4,2,1,16,8,8,75,1024,805306368,1099645845504,1365,9.54481,78.5768,115209
1,CUTLASS,gemm,cutlass_tensorop_s1688gemm_f16_256x128_32x2_nt_align8,passed,success,universal,8192,8192,8192,f16:column,f16:row,f32:column,f32:column,1,1,serial,1,1,heuristic,invalid,invalid,false,false,1,tensorop,f32,256,128,32,1,1,1,0,0,0,2,4,2,1,16,8,8,75,1024,805306368,1099645845504,1365,9.55003,78.5338,115146
1,CUTLASS,gemm,cutlass_tensorop_s1688gemm_f16_256x128_32x2_tn_align8,passed,success,universal,8192,8192,8192,f16:row,f16:column,f32:column,f32:column,1,1,serial,1,1,heuristic,invalid,invalid,false,false,1,tensorop,f32,256,128,32,1,1,1,0,0,0,2,4,2,1,16,8,8,75,1024,805306368,1099645845504,1365,9.55003,78.5338,115146
1,CUTLASS,gemm,cutlass_tensorop_s1688gemm_f16_256x128_32x2_tt_align8,passed,success,universal,8192,8192,8192,f16:row,f16:row,f32:column,f32:column,1,1,serial,1,1,heuristic,invalid,invalid,false,false,1,tensorop,f32,256,128,32,1,1,1,0,0,0,2,4,2,1,16,8,8,75,1024,805306368,1099645845504,1365,9.52709,78.7228,115423
1,CUTLASS,gemm,cutlass_tensorop_f16_s1688gemm_f16_256x128_32x2_nn_align8,passed,success,universal,8192,8192,8192,f16:column,f16:column,f16:column,f16:column,1,1,serial,1,1,heuristic,invalid,invalid,false,false,1,tensorop,f32,256,128,32,1,1,1,0,0,0,2,4,2,1,16,8,8,75,1024,536870912,1099645845504,2048,9.5191,52.526,115520
1,CUTLASS,gemm,cutlass_tensorop_f16_s1688gemm_f16_256x128_32x2_nt_align8,passed,success,universal,8192,8192,8192,f16:column,f16:row,f16:column,f16:column,1,1,serial,1,1,heuristic,invalid,invalid,false,false,1,tensorop,f32,256,128,32,1,1,1,0,0,0,2,4,2,1,16,8,8,75,1024,536870912,1099645845504,2048,9.5281,52.4764,115411
1,CUTLASS,gemm,cutlass_tensorop_f16_s1688gemm_f16_256x128_32x2_tn_align8,passed,success,universal,8192,8192,8192,f16:row,f16:column,f16:column,f16:column,1,1,serial,1,1,heuristic,invalid,invalid,false,false,1,tensorop,f32,256,128,32,1,1,1,0,0,0,2,4,2,1,16,8,8,75,1024,536870912,1099645845504,2048,9.53324,52.4481,115349
1,CUTLASS,gemm,cutlass_tensorop_f16_s1688gemm_f16_256x128_32x2_tt_align8,passed,success,universal,8192,8192,8192,f16:row,f16:row,f16:column,f16:column,1,1,serial,1,1,heuristic,invalid,invalid,false,false,1,tensorop,f32,256,128,32,1,1,1,0,0,0,2,4,2,1,16,8,8,75,1024,536870912,1099645845504,2048,9.50721,52.5916,115664
1,CUTLASS,gemm,cutlass_tensorop_h1688gemm_256x128_32x2_nn_align8,passed,success,universal,8192,8192,8192,f16:column,f16:column,f16:column,f16:column,1,1,serial,1,1,heuristic,invalid,invalid,false,false,1,tensorop,f16,256,128,32,1,1,1,0,0,0,2,4,2,1,16,8,8,75,1024,536870912,1099645845504,2048,4.88243,102.408,225225
1,CUTLASS,gemm,cutlass_tensorop_h1688gemm_256x128_32x2_nt_align8,passed,success,universal,8192,8192,8192,f16:column,f16:row,f16:column,f16:column,1,1,serial,1,1,heuristic,invalid,invalid,false,false,1,tensorop,f16,256,128,32,1,1,1,0,0,0,2,4,2,1,16,8,8,75,1024,536870912,1099645845504,2048,4.86901,102.69,225846
1,CUTLASS,gemm,cutlass_tensorop_h1688gemm_256x128_32x2_tn_align8,passed,success,universal,8192,8192,8192,f16:row,f16:column,f16:column,f16:column,1,1,serial,1,1,heuristic,invalid,invalid,false,false,1,tensorop,f16,256,128,32,1,1,1,0,0,0,2,4,2,1,16,8,8,75,1024,536870912,1099645845504,2048,4.84782,103.139,226833
1,CUTLASS,gemm,cutlass_tensorop_h1688gemm_256x128_32x2_tt_align8,passed,success,universal,8192,8192,8192,f16:row,f16:row,f16:column,f16:column,1,1,serial,1,1,heuristic,invalid,invalid,false,false,1,tensorop,f16,256,128,32,1,1,1,0,0,0,2,4,2,1,16,8,8,75,1024,536870912,1099645845504,2048,4.84659,103.165,226891
1,CUTLASS,gemm,cutlass_tensorop_s16816gemm_f16_256x128_32x3_nn_align8,passed,success,universal,8192,8192,8192,f16:column,f16:column,f32:column,f32:column,1,1,serial,1,1,heuristic,invalid,invalid,false,false,1,tensorop,f32,256,128,32,1,1,1,0,0,0,3,4,2,1,16,8,16,80,1024,805306368,1099645845504,1365,4.84372,154.84,227025
1,CUTLASS,gemm,cutlass_tensorop_s16816gemm_f16_256x128_32x3_nt_align8,passed,success,universal,8192,8192,8192,f16:column,f16:row,f32:column,f32:column,1,1,serial,1,1,heuristic,invalid,invalid,false,false,1,tensorop,f32,256,128,32,1,1,1,0,0,0,3,4,2,1,16,8,16,80,1024,805306368,1099645845504,1365,4.82744,155.362,227791
1,CUTLASS,gemm,cutlass_tensorop_s16816gemm_f16_256x128_32x3_tn_align8,passed,success,universal,8192,8192,8192,f16:row,f16:column,f32:column,f32:column,1,1,serial,1,1,heuristic,invalid,invalid,false,false,1,tensorop,f32,256,128,32,1,1,1,0,0,0,3,4,2,1,16,8,16,80,1024,805306368,1099645845504,1365,4.84536,154.787,226948
1,CUTLASS,gemm,cutlass_tensorop_s16816gemm_f16_256x128_32x3_tt_align8,passed,success,universal,8192,8192,8192,f16:row,f16:row,f32:column,f32:column,1,1,serial,1,1,heuristic,invalid,invalid,false,false,1,tensorop,f32,256,128,32,1,1,1,0,0,0,3,4,2,1,16,8,16,80,1024,805306368,1099645845504,1365,4.86092,154.292,226222
1,CUTLASS,gemm,cutlass_tensorop_f16_s16816gemm_f16_256x128_32x3_nn_align8,passed,success,universal,8192,8192,8192,f16:column,f16:column,f16:column,f16:column,1,1,serial,1,1,heuristic,invalid,invalid,false,false,1,tensorop,f32,256,128,32,1,1,1,0,0,0,3,4,2,1,16,8,16,80,1024,536870912,1099645845504,2048,4.81546,103.832,228357
1,CUTLASS,gemm,cutlass_tensorop_f16_s16816gemm_f16_256x128_32x3_nt_align8,passed,success,universal,8192,8192,8192,f16:column,f16:row,f16:column,f16:column,1,1,serial,1,1,heuristic,invalid,invalid,false,false,1,tensorop,f32,256,128,32,1,1,1,0,0,0,3,4,2,1,16,8,16,80,1024,536870912,1099645845504,2048,4.8127,103.892,228488
1,CUTLASS,gemm,cutlass_tensorop_f16_s16816gemm_f16_256x128_32x3_tn_align8,passed,success,universal,8192,8192,8192,f16:row,f16:column,f16:column,f16:column,1,1,serial,1,1,heuristic,invalid,invalid,false,false,1,tensorop,f32,256,128,32,1,1,1,0,0,0,3,4,2,1,16,8,16,80,1024,536870912,1099645845504,2048,4.82109,103.711,228090
1,CUTLASS,gemm,cutlass_tensorop_f16_s16816gemm_f16_256x128_32x3_tt_align8,passed,success,universal,8192,8192,8192,f16:row,f16:row,f16:column,f16:column,1,1,serial,1,1,heuristic,invalid,invalid,false,false,1,tensorop,f32,256,128,32,1,1,1,0,0,0,3,4,2,1,16,8,16,80,1024,536870912,1099645845504,2048,4.83031,103.513,227655
1,CUTLASS,gemm,cutlass_tensorop_h16816gemm_256x128_32x3_nn_align8,passed,success,universal,8192,8192,8192,f16:column,f16:column,f16:column,f16:column,1,1,serial,1,1,heuristic,invalid,invalid,false,false,1,tensorop,f16,256,128,32,1,1,1,0,0,0,3,4,2,1,16,8,16,80,1024,536870912,1099645845504,2048,2.72824,183.268,403060
1,CUTLASS,gemm,cutlass_tensorop_h16816gemm_256x128_32x3_nt_align8,passed,success,universal,8192,8192,8192,f16:column,f16:row,f16:column,f16:column,1,1,serial,1,1,heuristic,invalid,invalid,false,false,1,tensorop,f16,256,128,32,1,1,1,0,0,0,3,4,2,1,16,8,16,80,1024,536870912,1099645845504,2048,2.64089,189.33,416392
1,CUTLASS,gemm,cutlass_tensorop_h16816gemm_256x128_32x3_tn_align8,passed,success,universal,8192,8192,8192,f16:row,f16:column,f16:column,f16:column,1,1,serial,1,1,heuristic,invalid,invalid,false,false,1,tensorop,f16,256,128,32,1,1,1,0,0,0,3,4,2,1,16,8,16,80,1024,536870912,1099645845504,2048,2.73684,182.692,401793
1,CUTLASS,gemm,cutlass_tensorop_h16816gemm_256x128_32x3_tt_align8,passed,success,universal,8192,8192,8192,f16:row,f16:row,f16:column,f16:column,1,1,serial,1,1,heuristic,invalid,invalid,false,false,1,tensorop,f16,256,128,32,1,1,1,0,0,0,3,4,2,1,16,8,16,80,1024,536870912,1099645845504,2048,2.67428,186.966,411193
1,CUTLASS,gemm,cutlass_tensorop_s16816gemm_bf16_256x128_32x3_nn_align8,passed,success,universal,8192,8192,8192,bf16:column,bf16:column,f32:column,f32:column,1,1,serial,1,1,heuristic,invalid,invalid,false,false,1,tensorop,f32,256,128,32,1,1,1,0,0,0,3,4,2,1,16,8,16,80,1024,805306368,1099645845504,1365,4.84936,154.66,226761
1,CUTLASS,gemm,cutlass_tensorop_s16816gemm_bf16_256x128_32x3_nt_align8,passed,success,universal,8192,8192,8192,bf16:column,bf16:row,f32:column,f32:column,1,1,serial,1,1,heuristic,invalid,invalid,false,false,1,tensorop,f32,256,128,32,1,1,1,0,0,0,3,4,2,1,16,8,16,80,1024,805306368,1099645845504,1365,4.82959,155.293,227689
1,CUTLASS,gemm,cutlass_tensorop_s16816gemm_bf16_256x128_32x3_tn_align8,passed,success,universal,8192,8192,8192,bf16:row,bf16:column,f32:column,f32:column,1,1,serial,1,1,heuristic,invalid,invalid,false,false,1,tensorop,f32,256,128,32,1,1,1,0,0,0,3,4,2,1,16,8,16,80,1024,805306368,1099645845504,1365,4.84639,154.754,226900
1,CUTLASS,gemm,cutlass_tensorop_s16816gemm_bf16_256x128_32x3_tt_align8,passed,success,universal,8192,8192,8192,bf16:row,bf16:row,f32:column,f32:column,1,1,serial,1,1,heuristic,invalid,invalid,false,false,1,tensorop,f32,256,128,32,1,1,1,0,0,0,3,4,2,1,16,8,16,80,1024,805306368,1099645845504,1365,4.86226,154.249,226159
1,CUTLASS,gemm,cutlass_tensorop_bf16_s16816gemm_bf16_256x128_32x3_nn_align8,passed,success,universal,8192,8192,8192,bf16:column,bf16:column,bf16:column,bf16:column,1,1,serial,1,1,heuristic,invalid,invalid,false,false,1,tensorop,f32,256,128,32,1,1,1,0,0,0,3,4,2,1,16,8,16,80,1024,536870912,1099645845504,2048,4.82273,103.676,228013
1,CUTLASS,gemm,cutlass_tensorop_bf16_s16816gemm_bf16_256x128_32x3_nt_align8,passed,success,universal,8192,8192,8192,bf16:column,bf16:row,bf16:column,bf16:column,1,1,serial,1,1,heuristic,invalid,invalid,false,false,1,tensorop,f32,256,128,32,1,1,1,0,0,0,3,4,2,1,16,8,16,80,1024,536870912,1099645845504,2048,4.81311,103.883,228469
1,CUTLASS,gemm,cutlass_tensorop_bf16_s16816gemm_bf16_256x128_32x3_tn_align8,passed,success,universal,8192,8192,8192,bf16:row,bf16:column,bf16:column,bf16:column,1,1,serial,1,1,heuristic,invalid,invalid,false,false,1,tensorop,f32,256,128,32,1,1,1,0,0,0,3,4,2,1,16,8,16,80,1024,536870912,1099645845504,2048,4.82324,103.665,227989
1,CUTLASS,gemm,cutlass_tensorop_bf16_s16816gemm_bf16_256x128_32x3_tt_align8,passed,success,universal,8192,8192,8192,bf16:row,bf16:row,bf16:column,bf16:column,1,1,serial,1,1,heuristic,invalid,invalid,false,false,1,tensorop,f32,256,128,32,1,1,1,0,0,0,3,4,2,1,16,8,16,80,1024,536870912,1099645845504,2048,4.83369,103.441,227496
1,CUTLASS,gemm,cutlass_tensorop_s1688gemm_tf32_256x128_16x3_nn_align4,passed,success,universal,8192,8192,8192,tf32:column,tf32:column,f32:column,f32:column,1,1,serial,1,1,heuristic,invalid,invalid,false,false,1,tensorop,f32,256,128,16,1,1,1,0,0,0,3,4,2,1,16,8,8,80,1024,1073741824,1099645845504,1024,9.55873,104.616,115041
1,CUTLASS,gemm,cutlass_tensorop_s1688gemm_tf32_256x128_16x3_nt_align4,passed,success,universal,8192,8192,8192,tf32:column,tf32:row,f32:column,f32:column,1,1,serial,1,1,heuristic,invalid,invalid,false,false,1,tensorop,f32,256,128,16,1,1,1,0,0,0,3,4,2,1,16,8,8,80,1024,1073741824,1099645845504,1024,9.53743,104.85,115298
1,CUTLASS,gemm,cutlass_tensorop_s1688gemm_tf32_256x128_16x3_tn_align4,passed,success,universal,8192,8192,8192,tf32:row,tf32:column,f32:column,f32:column,1,1,serial,1,1,heuristic,invalid,invalid,false,false,1,tensorop,f32,256,128,16,1,1,1,0,0,0,3,4,2,1,16,8,8,80,1024,1073741824,1099645845504,1024,9.57604,104.427,114833
1,CUTLASS,gemm,cutlass_tensorop_s1688gemm_tf32_256x128_16x3_tt_align4,passed,success,universal,8192,8192,8192,tf32:row,tf32:row,f32:column,f32:column,1,1,serial,1,1,heuristic,invalid,invalid,false,false,1,tensorop,f32,256,128,16,1,1,1,0,0,0,3,4,2,1,16,8,8,80,1024,1073741824,1099645845504,1024,9.54604,104.756,115194
1,CUTLASS,gemm,cutlass_tensorop_tf32_s1688gemm_tf32_256x128_16x3_nn_align4,passed,success,universal,8192,8192,8192,tf32:column,tf32:column,tf32:column,tf32:column,1,1,serial,1,1,heuristic,invalid,invalid,false,false,1,tensorop,f32,256,128,16,1,1,1,0,0,0,3,4,2,1,16,8,8,80,1024,1073741824,1099645845504,1024,9.55811,104.623,115048
1,CUTLASS,gemm,cutlass_tensorop_tf32_s1688gemm_tf32_256x128_16x3_nt_align4,passed,success,universal,8192,8192,8192,tf32:column,tf32:row,tf32:column,tf32:column,1,1,serial,1,1,heuristic,invalid,invalid,false,false,1,tensorop,f32,256,128,16,1,1,1,0,0,0,3,4,2,1,16,8,8,80,1024,1073741824,1099645845504,1024,9.53917,104.831,115277
1,CUTLASS,gemm,cutlass_tensorop_tf32_s1688gemm_tf32_256x128_16x3_tn_align4,passed,success,universal,8192,8192,8192,tf32:row,tf32:column,tf32:column,tf32:column,1,1,serial,1,1,heuristic,invalid,invalid,false,false,1,tensorop,f32,256,128,16,1,1,1,0,0,0,3,4,2,1,16,8,8,80,1024,1073741824,1099645845504,1024,9.57563,104.432,114838
1,CUTLASS,gemm,cutlass_tensorop_tf32_s1688gemm_tf32_256x128_16x3_tt_align4,passed,success,universal,8192,8192,8192,tf32:row,tf32:row,tf32:column,tf32:column,1,1,serial,1,1,heuristic,invalid,invalid,false,false,1,tensorop,f32,256,128,16,1,1,1,0,0,0,3,4,2,1,16,8,8,80,1024,1073741824,1099645845504,1024,9.54542,104.762,115201
1,CUTLASS,gemm,cutlass_tensorop_s1688tf32gemm_256x128_16x3_nn_align4,passed,success,universal,8192,8192,8192,f32:column,f32:column,f32:column,f32:column,1,1,serial,1,1,heuristic,invalid,invalid,false,false,1,tensorop,f32,256,128,16,1,1,1,0,0,0,3,4,2,1,16,8,8,80,1024,1073741824,1099645845504,1024,9.63932,103.742,114079
1,CUTLASS,gemm,cutlass_tensorop_s1688tf32gemm_256x128_16x3_nt_align4,passed,success,universal,8192,8192,8192,f32:column,f32:row,f32:column,f32:column,1,1,serial,1,1,heuristic,invalid,invalid,false,false,1,tensorop,f32,256,128,16,1,1,1,0,0,0,3,4,2,1,16,8,8,80,1024,1073741824,1099645845504,1024,9.62642,103.881,114232
1,CUTLASS,gemm,cutlass_tensorop_s1688tf32gemm_256x128_16x3_tn_align4,passed,success,universal,8192,8192,8192,f32:row,f32:column,f32:column,f32:column,1,1,serial,1,1,heuristic,invalid,invalid,false,false,1,tensorop,f32,256,128,16,1,1,1,0,0,0,3,4,2,1,16,8,8,80,1024,1073741824,1099645845504,1024,9.59744,104.194,114577
1,CUTLASS,gemm,cutlass_tensorop_s1688tf32gemm_256x128_16x3_tt_align4,passed,success,universal,8192,8192,8192,f32:row,f32:row,f32:column,f32:column,1,1,serial,1,1,heuristic,invalid,invalid,false,false,1,tensorop,f32,256,128,16,1,1,1,0,0,0,3,4,2,1,16,8,8,80,1024,1073741824,1099645845504,1024,9.57102,104.482,114893
1,CUTLASS,gemm,cutlass_tensorop_s1688f16gemm_256x128_16x3_nn_align4,passed,success,universal,8192,8192,8192,f32:column,f32:column,f32:column,f32:column,1,1,serial,1,1,heuristic,invalid,invalid,false,false,1,tensorop,f32,256,128,16,1,1,1,0,0,0,3,4,2,1,16,8,8,75,1024,1073741824,1099645845504,1024,9.56027,104.6,115022
1,CUTLASS,gemm,cutlass_tensorop_s1688f16gemm_256x128_16x3_nt_align4,passed,success,universal,8192,8192,8192,f32:column,f32:row,f32:column,f32:column,1,1,serial,1,1,heuristic,invalid,invalid,false,false,1,tensorop,f32,256,128,16,1,1,1,0,0,0,3,4,2,1,16,8,8,75,1024,1073741824,1099645845504,1024,9.55157,104.695,115127
1,CUTLASS,gemm,cutlass_tensorop_s1688f16gemm_256x128_16x3_tn_align4,passed,success,universal,8192,8192,8192,f32:row,f32:column,f32:column,f32:column,1,1,serial,1,1,heuristic,invalid,invalid,false,false,1,tensorop,f32,256,128,16,1,1,1,0,0,0,3,4,2,1,16,8,8,75,1024,1073741824,1099645845504,1024,9.55484,104.659,115088
1,CUTLASS,gemm,cutlass_tensorop_s1688f16gemm_256x128_16x3_tt_align4,passed,success,universal,8192,8192,8192,f32:row,f32:row,f32:column,f32:column,1,1,serial,1,1,heuristic,invalid,invalid,false,false,1,tensorop,f32,256,128,16,1,1,1,0,0,0,3,4,2,1,16,8,8,75,1024,1073741824,1099645845504,1024,9.5661,104.536,114952
1,CUTLASS,gemm,cutlass_tensorop_s1688bf16gemm_256x128_16x3_nn_align4,passed,success,universal,8192,8192,8192,f32:column,f32:column,f32:column,f32:column,1,1,serial,1,1,heuristic,invalid,invalid,false,false,1,tensorop,f32,256,128,16,1,1,1,0,0,0,3,4,2,1,16,8,8,80,1024,1073741824,1099645845504,1024,9.58116,104.372,114772
1,CUTLASS,gemm,cutlass_tensorop_s1688bf16gemm_256x128_16x3_nt_align4,passed,success,universal,8192,8192,8192,f32:column,f32:row,f32:column,f32:column,1,1,serial,1,1,heuristic,invalid,invalid,false,false,1,tensorop,f32,256,128,16,1,1,1,0,0,0,3,4,2,1,16,8,8,80,1024,1073741824,1099645845504,1024,9.55402,104.668,115098
1,CUTLASS,gemm,cutlass_tensorop_s1688bf16gemm_256x128_16x3_tn_align4,passed,success,universal,8192,8192,8192,f32:row,f32:column,f32:column,f32:column,1,1,serial,1,1,heuristic,invalid,invalid,false,false,1,tensorop,f32,256,128,16,1,1,1,0,0,0,3,4,2,1,16,8,8,80,1024,1073741824,1099645845504,1024,9.55259,104.684,115115
1,CUTLASS,gemm,cutlass_tensorop_s1688bf16gemm_256x128_16x3_tt_align4,passed,success,universal,8192,8192,8192,f32:row,f32:row,f32:column,f32:column,1,1,serial,1,1,heuristic,invalid,invalid,false,false,1,tensorop,f32,256,128,16,1,1,1,0,0,0,3,4,2,1,16,8,8,80,1024,1073741824,1099645845504,1024,9.56938,104.5,114913
1,CUTLASS,gemm,cutlass_tensorop_s1688gemm_128x128_16x4_nn_align4,passed,success,universal,8192,8192,8192,f32:column,f32:column,f32:column,f32:column,1,1,serial,1,1,heuristic,invalid,invalid,false,false,1,tensorop,f32,128,128,16,1,1,1,0,0,0,4,4,2,1,16,8,8,80,1024,1073741824,1099645845504,1024,28.1004,35.5867,39132.7
1,CUTLASS,gemm,cutlass_tensorop_s1688gemm_128x128_16x4_nt_align4,passed,success,universal,8192,8192,8192,f32:column,f32:row,f32:column,f32:column,1,1,serial,1,1,heuristic,invalid,invalid,false,false,1,tensorop,f32,128,128,16,1,1,1,0,0,0,4,4,2,1,16,8,8,80,1024,1073741824,1099645845504,1024,28.1724,35.4958,39032.8
1,CUTLASS,gemm,cutlass_tensorop_s1688gemm_128x128_16x4_tn_align4,passed,success,universal,8192,8192,8192,f32:row,f32:column,f32:column,f32:column,1,1,serial,1,1,heuristic,invalid,invalid,false,false,1,tensorop,f32,128,128,16,1,1,1,0,0,0,4,4,2,1,16,8,8,80,1024,1073741824,1099645845504,1024,28.0441,35.6581,39211.3
1,CUTLASS,gemm,cutlass_tensorop_s1688gemm_128x128_16x4_tt_align4,passed,success,universal,8192,8192,8192,f32:row,f32:row,f32:column,f32:column,1,1,serial,1,1,heuristic,invalid,invalid,false,false,1,tensorop,f32,128,128,16,1,1,1,0,0,0,4,4,2,1,16,8,8,80,1024,1073741824,1099645845504,1024,28.1039,35.5823,39127.9
1,CUTLASS,gemm,cutlass_tensorop_c1688gemm_128x64_16x3_nn_align1,passed,success,universal,8192,8192,8192,cf32:column,cf32:column,cf32:column,cf32:column,1,1,serial,1,1,heuristic,invalid,invalid,false,false,1,tensorop,cf32,128,64,16,1,1,1,0,0,0,3,4,2,1,16,8,8,80,1024,2147483648,4398583382016,2048,111.062,18.0079,39604.6
1,CUTLASS,gemm,cutlass_tensorop_c1688gemm_128x64_16x3_cn_align1,passed,success,universal,8192,8192,8192,cf32:column,cf32:column,cf32:column,cf32:column,1,1,serial,1,1,heuristic,invalid,invalid,false,false,1,tensorop,cf32,128,64,16,1,1,1,0,0,0,3,4,2,1,16,8,8,80,1024,2147483648,4398583382016,2048,124.848,16.0195,35231.6
1,CUTLASS,gemm,cutlass_tensorop_c1688gemm_128x64_16x3_nc_align1,passed,success,universal,8192,8192,8192,cf32:column,cf32:column,cf32:column,cf32:column,1,1,serial,1,1,heuristic,invalid,invalid,false,false,1,tensorop,cf32,128,64,16,1,1,1,0,0,0,3,4,2,1,16,8,8,80,1024,2147483648,4398583382016,2048,110.799,18.0507,39698.7
1,CUTLASS,gemm,cutlass_tensorop_c1688gemm_128x64_16x3_cc_align1,passed,success,universal,8192,8192,8192,cf32:column,cf32:column,cf32:column,cf32:column,1,1,serial,1,1,heuristic,invalid,invalid,false,false,1,tensorop,cf32,128,64,16,1,1,1,0,0,0,3,4,2,1,16,8,8,80,1024,2147483648,4398583382016,2048,121.816,16.4182,36108.4
1,CUTLASS,gemm,cutlass_tensorop_c1688gemm_128x64_16x3_nt_align1,passed,success,universal,8192,8192,8192,cf32:column,cf32:row,cf32:column,cf32:column,1,1,serial,1,1,heuristic,invalid,invalid,false,false,1,tensorop,cf32,128,64,16,1,1,1,0,0,0,3,4,2,1,16,8,8,80,1024,2147483648,4398583382016,2048,109.878,18.202,40031.6
1,CUTLASS,gemm,cutlass_tensorop_c1688gemm_128x64_16x3_ct_align1,passed,success,universal,8192,8192,8192,cf32:column,cf32:row,cf32:column,cf32:column,1,1,serial,1,1,heuristic,invalid,invalid,false,false,1,tensorop,cf32,128,64,16,1,1,1,0,0,0,3,4,2,1,16,8,8,80,1024,2147483648,4398583382016,2048,109.395,18.2824,40208.4
1,CUTLASS,gemm,cutlass_tensorop_c1688gemm_128x64_16x3_nh_align1,passed,success,universal,8192,8192,8192,cf32:column,cf32:row,cf32:column,cf32:column,1,1,serial,1,1,heuristic,invalid,invalid,false,false,1,tensorop,cf32,128,64,16,1,1,1,0,0,0,3,4,2,1,16,8,8,80,1024,2147483648,4398583382016,2048,111.175,17.9897,39564.5
1,CUTLASS,gemm,cutlass_tensorop_c1688gemm_128x64_16x3_ch_align1,passed,success,universal,8192,8192,8192,cf32:column,cf32:row,cf32:column,cf32:column,1,1,serial,1,1,heuristic,invalid,invalid,false,false,1,tensorop,cf32,128,64,16,1,1,1,0,0,0,3,4,2,1,16,8,8,80,1024,2147483648,4398583382016,2048,109.503,18.2644,40168.8
1,CUTLASS,gemm,cutlass_tensorop_c1688gemm_128x64_16x3_tn_align1,passed,success,universal,8192,8192,8192,cf32:row,cf32:column,cf32:column,cf32:column,1,1,serial,1,1,heuristic,invalid,invalid,false,false,1,tensorop,cf32,128,64,16,1,1,1,0,0,0,3,4,2,1,16,8,8,80,1024,2147483648,4398583382016,2048,112.237,17.8194,39190.1
1,CUTLASS,gemm,cutlass_tensorop_c1688gemm_128x64_16x3_hn_align1,passed,success,universal,8192,8192,8192,cf32:row,cf32:column,cf32:column,cf32:column,1,1,serial,1,1,heuristic,invalid,invalid,false,false,1,tensorop,cf32,128,64,16,1,1,1,0,0,0,3,4,2,1,16,8,8,80,1024,2147483648,4398583382016,2048,121.834,16.4157,36103
1,CUTLASS,gemm,cutlass_tensorop_c1688gemm_128x64_16x3_tc_align1,passed,success,universal,8192,8192,8192,cf32:row,cf32:column,cf32:column,cf32:column,1,1,serial,1,1,heuristic,invalid,invalid,false,false,1,tensorop,cf32,128,64,16,1,1,1,0,0,0,3,4,2,1,16,8,8,80,1024,2147483648,4398583382016,2048,110.033,18.1763,39975
1,CUTLASS,gemm,cutlass_tensorop_c1688gemm_128x64_16x3_hc_align1,passed,success,universal,8192,8192,8192,cf32:row,cf32:column,cf32:column,cf32:column,1,1,serial,1,1,heuristic,invalid,invalid,false,false,1,tensorop,cf32,128,64,16,1,1,1,0,0,0,3,4,2,1,16,8,8,80,1024,2147483648,4398583382016,2048,117.392,17.037,37469.2
1,CUTLASS,gemm,cutlass_tensorop_c1688gemm_128x64_16x3_tt_align1,passed,success,universal,8192,8192,8192,cf32:row,cf32:row,cf32:column,cf32:column,1,1,serial,1,1,heuristic,invalid,invalid,false,false,1,tensorop,cf32,128,64,16,1,1,1,0,0,0,3,4,2,1,16,8,8,80,1024,2147483648,4398583382016,2048,113.854,17.5663,38633.5
1,CUTLASS,gemm,cutlass_tensorop_c1688gemm_128x64_16x3_ht_align1,passed,success,universal,8192,8192,8192,cf32:row,cf32:row,cf32:column,cf32:column,1,1,serial,1,1,heuristic,invalid,invalid,false,false,1,tensorop,cf32,128,64,16,1,1,1,0,0,0,3,4,2,1,16,8,8,80,1024,2147483648,4398583382016,2048,117.737,16.987,37359.4
1,CUTLASS,gemm,cutlass_tensorop_c1688gemm_128x64_16x3_th_align1,passed,success,universal,8192,8192,8192,cf32:row,cf32:row,cf32:column,cf32:column,1,1,serial,1,1,heuristic,invalid,invalid,false,false,1,tensorop,cf32,128,64,16,1,1,1,0,0,0,3,4,2,1,16,8,8,80,1024,2147483648,4398583382016,2048,111.713,17.903,39373.8
1,CUTLASS,gemm,cutlass_tensorop_c1688gemm_128x64_16x3_hh_align1,passed,success,universal,8192,8192,8192,cf32:row,cf32:row,cf32:column,cf32:column,1,1,serial,1,1,heuristic,invalid,invalid,false,false,1,tensorop,cf32,128,64,16,1,1,1,0,0,0,3,4,2,1,16,8,8,80,1024,2147483648,4398583382016,2048,112.075,17.8452,39246.8
1,CUTLASS,gemm,cutlass_tensorop_d884gemm_128x128_16x3_nn_align1,passed,success,universal,8192,8192,8192,f64:column,f64:column,f64:column,f64:column,1,1,serial,1,1,heuristic,invalid,invalid,false,false,1,tensorop,f64,128,128,16,1,1,1,0,0,0,3,4,2,1,8,8,4,80,1024,2147483648,1099645845504,512,659.154,3.03419,1668.27
1,CUTLASS,gemm,cutlass_tensorop_d884gemm_128x128_16x3_nt_align1,passed,success,universal,8192,8192,8192,f64:column,f64:row,f64:column,f64:column,1,1,serial,1,1,heuristic,invalid,invalid,false,false,1,tensorop,f64,128,128,16,1,1,1,0,0,0,3,4,2,1,8,8,4,80,1024,2147483648,1099645845504,512,659.646,3.03193,1667.02
1,CUTLASS,gemm,cutlass_tensorop_d884gemm_128x128_16x3_tn_align1,passed,success,universal,8192,8192,8192,f64:row,f64:column,f64:column,f64:column,1,1,serial,1,1,heuristic,invalid,invalid,false,false,1,tensorop,f64,128,128,16,1,1,1,0,0,0,3,4,2,1,8,8,4,80,1024,2147483648,1099645845504,512,659.948,3.03054,1666.26
1,CUTLASS,gemm,cutlass_tensorop_d884gemm_128x128_16x3_tt_align1,passed,success,universal,8192,8192,8192,f64:row,f64:row,f64:column,f64:column,1,1,serial,1,1,heuristic,invalid,invalid,false,false,1,tensorop,f64,128,128,16,1,1,1,0,0,0,3,4,2,1,8,8,4,80,1024,2147483648,1099645845504,512,657.448,3.04206,1672.6
1,CUTLASS,gemm,cutlass_tensorop_z884gemm_128x64_8x3_nn_align1,passed,success,universal,8192,8192,8192,cf64:column,cf64:column,cf64:column,cf64:column,1,1,serial,1,1,heuristic,invalid,invalid,false,false,1,tensorop,cf64,128,64,8,1,1,1,0,0,0,3,4,2,1,8,8,4,80,1024,4294967296,4398583382016,1024,2575.86,1.55288,1707.62
1,CUTLASS,gemm,cutlass_tensorop_z884gemm_128x64_8x3_cn_align1,passed,success,universal,8192,8192,8192,cf64:column,cf64:column,cf64:column,cf64:column,1,1,serial,1,1,heuristic,invalid,invalid,false,false,1,tensorop,cf64,128,64,8,1,1,1,0,0,0,3,4,2,1,8,8,4,80,1024,4294967296,4398583382016,1024,2577.42,1.55194,1706.58
1,CUTLASS,gemm,cutlass_tensorop_z884gemm_128x64_8x3_nc_align1,passed,success,universal,8192,8192,8192,cf64:column,cf64:column,cf64:column,cf64:column,1,1,serial,1,1,heuristic,invalid,invalid,false,false,1,tensorop,cf64,128,64,8,1,1,1,0,0,0,3,4,2,1,8,8,4,80,1024,4294967296,4398583382016,1024,2578.01,1.55158,1706.19
1,CUTLASS,gemm,cutlass_tensorop_z884gemm_128x64_8x3_cc_align1,passed,success,universal,8192,8192,8192,cf64:column,cf64:column,cf64:column,cf64:column,1,1,serial,1,1,heuristic,invalid,invalid,false,false,1,tensorop,cf64,128,64,8,1,1,1,0,0,0,3,4,2,1,8,8,4,80,1024,4294967296,4398583382016,1024,2576.7,1.55237,1707.06
1,CUTLASS,gemm,cutlass_tensorop_z884gemm_128x64_8x3_nt_align1,passed,success,universal,8192,8192,8192,cf64:column,cf64:row,cf64:column,cf64:column,1,1,serial,1,1,heuristic,invalid,invalid,false,false,1,tensorop,cf64,128,64,8,1,1,1,0,0,0,3,4,2,1,8,8,4,80,1024,4294967296,4398583382016,1024,2575.36,1.55318,1707.95
1,CUTLASS,gemm,cutlass_tensorop_z884gemm_128x64_8x3_ct_align1,passed,success,universal,8192,8192,8192,cf64:column,cf64:row,cf64:column,cf64:column,1,1,serial,1,1,heuristic,invalid,invalid,false,false,1,tensorop,cf64,128,64,8,1,1,1,0,0,0,3,4,2,1,8,8,4,80,1024,4294967296,4398583382016,1024,2573.87,1.55408,1708.94
1,CUTLASS,gemm,cutlass_tensorop_z884gemm_128x64_8x3_nh_align1,passed,success,universal,8192,8192,8192,cf64:column,cf64:row,cf64:column,cf64:column,1,1,serial,1,1,heuristic,invalid,invalid,false,false,1,tensorop,cf64,128,64,8,1,1,1,0,0,0,3,4,2,1,8,8,4,80,1024,4294967296,4398583382016,1024,2586.16,1.5467,1700.82
1,CUTLASS,gemm,cutlass_tensorop_z884gemm_128x64_8x3_ch_align1,passed,success,universal,8192,8192,8192,cf64:column,cf64:row,cf64:column,cf64:column,1,1,serial,1,1,heuristic,invalid,invalid,false,false,1,tensorop,cf64,128,64,8,1,1,1,0,0,0,3,4,2,1,8,8,4,80,1024,4294967296,4398583382016,1024,2586.5,1.54649,1700.59
1,CUTLASS,gemm,cutlass_tensorop_z884gemm_128x64_8x3_tn_align1,passed,success,universal,8192,8192,8192,cf64:row,cf64:column,cf64:column,cf64:column,1,1,serial,1,1,heuristic,invalid,invalid,false,false,1,tensorop,cf64,128,64,8,1,1,1,0,0,0,3,4,2,1,8,8,4,80,1024,4294967296,4398583382016,1024,2573.81,1.55412,1708.98
1,CUTLASS,gemm,cutlass_tensorop_z884gemm_128x64_8x3_hn_align1,passed,success,universal,8192,8192,8192,cf64:row,cf64:column,cf64:column,cf64:column,1,1,serial,1,1,heuristic,invalid,invalid,false,false,1,tensorop,cf64,128,64,8,1,1,1,0,0,0,3,4,2,1,8,8,4,80,1024,4294967296,4398583382016,1024,2574.75,1.55355,1708.36
1,CUTLASS,gemm,cutlass_tensorop_z884gemm_128x64_8x3_tc_align1,passed,success,universal,8192,8192,8192,cf64:row,cf64:column,cf64:column,cf64:column,1,1,serial,1,1,heuristic,invalid,invalid,false,false,1,tensorop,cf64,128,64,8,1,1,1,0,0,0,3,4,2,1,8,8,4,80,1024,4294967296,4398583382016,1024,2576.04,1.55277,1707.5
1,CUTLASS,gemm,cutlass_tensorop_z884gemm_128x64_8x3_hc_align1,passed,success,universal,8192,8192,8192,cf64:row,cf64:column,cf64:column,cf64:column,1,1,serial,1,1,heuristic,invalid,invalid,false,false,1,tensorop,cf64,128,64,8,1,1,1,0,0,0,3,4,2,1,8,8,4,80,1024,4294967296,4398583382016,1024,2577.16,1.5521,1706.76
1,CUTLASS,gemm,cutlass_tensorop_z884gemm_128x64_8x3_tt_align1,passed,success,universal,8192,8192,8192,cf64:row,cf64:row,cf64:column,cf64:column,1,1,serial,1,1,heuristic,invalid,invalid,false,false,1,tensorop,cf64,128,64,8,1,1,1,0,0,0,3,4,2,1,8,8,4,80,1024,4294967296,4398583382016,1024,2578.17,1.55149,1706.09
1,CUTLASS,gemm,cutlass_tensorop_z884gemm_128x64_8x3_ht_align1,passed,success,universal,8192,8192,8192,cf64:row,cf64:row,cf64:column,cf64:column,1,1,serial,1,1,heuristic,invalid,invalid,false,false,1,tensorop,cf64,128,64,8,1,1,1,0,0,0,3,4,2,1,8,8,4,80,1024,4294967296,4398583382016,1024,2576.93,1.55223,1706.91
1,CUTLASS,gemm,cutlass_tensorop_z884gemm_128x64_8x3_th_align1,passed,success,universal,8192,8192,8192,cf64:row,cf64:row,cf64:column,cf64:column,1,1,serial,1,1,heuristic,invalid,invalid,false,false,1,tensorop,cf64,128,64,8,1,1,1,0,0,0,3,4,2,1,8,8,4,80,1024,4294967296,4398583382016,1024,2575.25,1.55325,1708.02
1,CUTLASS,gemm,cutlass_tensorop_z884gemm_128x64_8x3_hh_align1,passed,success,universal,8192,8192,8192,cf64:row,cf64:row,cf64:column,cf64:column,1,1,serial,1,1,heuristic,invalid,invalid,false,false,1,tensorop,cf64,128,64,8,1,1,1,0,0,0,3,4,2,1,8,8,4,80,1024,4294967296,4398583382016,1024,2573.93,1.55404,1708.9
1,CUTLASS,gemm,cutlass_tensorop_gz884gemm_64x64_8x3_nn_align1,passed,success,universal,8192,8192,8192,cf64:column,cf64:column,cf64:column,cf64:column,1,1,serial,1,1,heuristic,invalid,invalid,false,false,1,tensorop,cf64,64,64,8,1,1,1,0,0,0,3,4,2,1,8,8,4,80,1024,4294967296,3298937536512,768,2029.88,1.97056,1625.19
1,CUTLASS,gemm,cutlass_tensorop_gz884gemm_64x64_8x3_cn_align1,passed,success,universal,8192,8192,8192,cf64:column,cf64:column,cf64:column,cf64:column,1,1,serial,1,1,heuristic,invalid,invalid,false,false,1,tensorop,cf64,64,64,8,1,1,1,0,0,0,3,4,2,1,8,8,4,80,1024,4294967296,3298937536512,768,2029.37,1.97105,1625.6
1,CUTLASS,gemm,cutlass_tensorop_gz884gemm_64x64_8x3_nc_align1,passed,success,universal,8192,8192,8192,cf64:column,cf64:column,cf64:column,cf64:column,1,1,serial,1,1,heuristic,invalid,invalid,false,false,1,tensorop,cf64,64,64,8,1,1,1,0,0,0,3,4,2,1,8,8,4,80,1024,4294967296,3298937536512,768,2030.15,1.9703,1624.97
1,CUTLASS,gemm,cutlass_tensorop_gz884gemm_64x64_8x3_cc_align1,passed,success,universal,8192,8192,8192,cf64:column,cf64:column,cf64:column,cf64:column,1,1,serial,1,1,heuristic,invalid,invalid,false,false,1,tensorop,cf64,64,64,8,1,1,1,0,0,0,3,4,2,1,8,8,4,80,1024,4294967296,3298937536512,768,2030.5,1.96996,1624.7
1,CUTLASS,gemm,cutlass_tensorop_gz884gemm_64x64_8x3_nt_align1,passed,success,universal,8192,8192,8192,cf64:column,cf64:row,cf64:column,cf64:column,1,1,serial,1,1,heuristic,invalid,invalid,false,false,1,tensorop,cf64,64,64,8,1,1,1,0,0,0,3,4,2,1,8,8,4,80,1024,4294967296,3298937536512,768,2017.79,1.98236,1634.92
1,CUTLASS,gemm,cutlass_tensorop_gz884gemm_64x64_8x3_ct_align1,passed,success,universal,8192,8192,8192,cf64:column,cf64:row,cf64:column,cf64:column,1,1,serial,1,1,heuristic,invalid,invalid,false,false,1,tensorop,cf64,64,64,8,1,1,1,0,0,0,3,4,2,1,8,8,4,80,1024,4294967296,3298937536512,768,2018.56,1.98161,1634.3
1,CUTLASS,gemm,cutlass_tensorop_gz884gemm_64x64_8x3_nh_align1,passed,success,universal,8192,8192,8192,cf64:column,cf64:row,cf64:column,cf64:column,1,1,serial,1,1,heuristic,invalid,invalid,false,false,1,tensorop,cf64,64,64,8,1,1,1,0,0,0,3,4,2,1,8,8,4,80,1024,4294967296,3298937536512,768,2019.33,1.98086,1633.68
1,CUTLASS,gemm,cutlass_tensorop_gz884gemm_64x64_8x3_ch_align1,passed,success,universal,8192,8192,8192,cf64:column,cf64:row,cf64:column,cf64:column,1,1,serial,1,1,heuristic,invalid,invalid,false,false,1,tensorop,cf64,64,64,8,1,1,1,0,0,0,3,4,2,1,8,8,4,80,1024,4294967296,3298937536512,768,2020.14,1.98006,1633.03
1,CUTLASS,gemm,cutlass_tensorop_gz884gemm_64x64_8x3_tn_align1,passed,success,universal,8192,8192,8192,cf64:row,cf64:column,cf64:column,cf64:column,1,1,serial,1,1,heuristic,invalid,invalid,false,false,1,tensorop,cf64,64,64,8,1,1,1,0,0,0,3,4,2,1,8,8,4,80,1024,4294967296,3298937536512,768,2021.74,1.97849,1631.73
1,CUTLASS,gemm,cutlass_tensorop_gz884gemm_64x64_8x3_hn_align1,passed,success,universal,8192,8192,8192,cf64:row,cf64:column,cf64:column,cf64:column,1,1,serial,1,1,heuristic,invalid,invalid,false,false,1,tensorop,cf64,64,64,8,1,1,1,0,0,0,3,4,2,1,8,8,4,80,1024,4294967296,3298937536512,768,2021.28,1.97895,1632.11
1,CUTLASS,gemm,cutlass_tensorop_gz884gemm_64x64_8x3_tc_align1,passed,success,universal,8192,8192,8192,cf64:row,cf64:column,cf64:column,cf64:column,1,1,serial,1,1,heuristic,invalid,invalid,false,false,1,tensorop,cf64,64,64,8,1,1,1,0,0,0,3,4,2,1,8,8,4,80,1024,4294967296,3298937536512,768,2020.03,1.98017,1633.11
1,CUTLASS,gemm,cutlass_tensorop_gz884gemm_64x64_8x3_hc_align1,passed,success,universal,8192,8192,8192,cf64:row,cf64:column,cf64:column,cf64:column,1,1,serial,1,1,heuristic,invalid,invalid,false,false,1,tensorop,cf64,64,64,8,1,1,1,0,0,0,3,4,2,1,8,8,4,80,1024,4294967296,3298937536512,768,2019.23,1.98095,1633.76
1,CUTLASS,gemm,cutlass_tensorop_gz884gemm_64x64_8x3_tt_align1,passed,success,universal,8192,8192,8192,cf64:row,cf64:row,cf64:column,cf64:column,1,1,serial,1,1,heuristic,invalid,invalid,false,false,1,tensorop,cf64,64,64,8,1,1,1,0,0,0,3,4,2,1,8,8,4,80,1024,4294967296,3298937536512,768,2028.97,1.97145,1625.92
1,CUTLASS,gemm,cutlass_tensorop_gz884gemm_64x64_8x3_ht_align1,passed,success,universal,8192,8192,8192,cf64:row,cf64:row,cf64:column,cf64:column,1,1,serial,1,1,heuristic,invalid,invalid,false,false,1,tensorop,cf64,64,64,8,1,1,1,0,0,0,3,4,2,1,8,8,4,80,1024,4294967296,3298937536512,768,2028.39,1.97201,1626.38
1,CUTLASS,gemm,cutlass_tensorop_gz884gemm_64x64_8x3_th_align1,passed,success,universal,8192,8192,8192,cf64:row,cf64:row,cf64:column,cf64:column,1,1,serial,1,1,heuristic,invalid,invalid,false,false,1,tensorop,cf64,64,64,8,1,1,1,0,0,0,3,4,2,1,8,8,4,80,1024,4294967296,3298937536512,768,2028.54,1.97186,1626.26
1,CUTLASS,gemm,cutlass_tensorop_gz884gemm_64x64_8x3_hh_align1,passed,success,universal,8192,8192,8192,cf64:row,cf64:row,cf64:column,cf64:column,1,1,serial,1,1,heuristic,invalid,invalid,false,false,1,tensorop,cf64,64,64,8,1,1,1,0,0,0,3,4,2,1,8,8,4,80,1024,4294967296,3298937536512,768,2029.05,1.97137,1625.86
1,CUTLASS,gemm,cutlass_tensorop_s16816gemm_s8_f16_128x128_64x4_tn_align16,passed,success,universal,8192,8192,8192,s8:row,f16:column,f32:column,f32:column,1,1,serial,1,1,heuristic,invalid,invalid,false,false,1,tensorop,f32,128,128,64,1,1,1,0,0,0,4,2,2,1,16,8,16,80,1024,738197504,1099645845504,1489,4.9022,140.243,224317
1,CUTLASS,gemm,cutlass_tensorop_f16_s16816gemm_s8_f16_128x128_64x4_tn_align16,passed,success,universal,8192,8192,8192,s8:row,f16:column,f16:column,f16:column,1,1,serial,1,1,heuristic,invalid,invalid,false,false,1,tensorop,f32,128,128,64,1,1,1,0,0,0,4,2,2,1,16,8,16,80,1024,469762048,1099645845504,2340,4.88795,89.5059,224971
1,CUTLASS,gemm,cutlass_tensorop_s16816gemm_u8_f16_128x128_64x4_tn_align16,passed,success,universal,8192,8192,8192,u8:row,f16:column,f32:column,f32:column,1,1,serial,1,1,heuristic,invalid,invalid,false,false,1,tensorop,f32,128,128,64,1,1,1,0,0,0,4,2,2,1,16,8,16,80,1024,738197504,1099645845504,1489,4.7923,143.459,229461
1,CUTLASS,gemm,cutlass_tensorop_f16_s16816gemm_u8_f16_128x128_64x4_tn_align16,passed,success,universal,8192,8192,8192,u8:row,f16:column,f16:column,f16:column,1,1,serial,1,1,heuristic,invalid,invalid,false,false,1,tensorop,f32,128,128,64,1,1,1,0,0,0,4,2,2,1,16,8,16,80,1024,469762048,1099645845504,2340,4.78669,91.3993,229730
1,CUTLASS,gemm,cutlass_tensorop_s16816gemm_s8_bf16_128x128_64x4_tn_align16,passed,success,universal,8192,8192,8192,s8:row,bf16:column,f32:column,f32:column,1,1,serial,1,1,heuristic,invalid,invalid,false,false,1,tensorop,f32,128,128,64,1,1,1,0,0,0,4,2,2,1,16,8,16,80,1024,738197504,1099645845504,1489,4.96506,138.468,221477
1,CUTLASS,gemm,cutlass_tensorop_bf16_s16816gemm_s8_bf16_128x128_64x4_tn_align16,passed,success,universal,8192,8192,8192,s8:row,bf16:column,bf16:column,bf16:column,1,1,serial,1,1,heuristic,invalid,invalid,false,false,1,tensorop,f32,128,128,64,1,1,1,0,0,0,4,2,2,1,16,8,16,80,1024,469762048,1099645845504,2340,4.95084,88.3689,222113
1,CUTLASS,gemm,cutlass_tensorop_s16816gemm_u8_bf16_128x128_64x4_tn_align16,passed,success,universal,8192,8192,8192,u8:row,bf16:column,f32:column,f32:column,1,1,serial,1,1,heuristic,invalid,invalid,false,false,1,tensorop,f32,128,128,64,1,1,1,0,0,0,4,2,2,1,16,8,16,80,1024,738197504,1099645845504,1489,4.94437,139.047,222404
1,CUTLASS,gemm,cutlass_tensorop_bf16_s16816gemm_u8_bf16_128x128_64x4_tn_align16,passed,success,universal,8192,8192,8192,u8:row,bf16:column,bf16:column,bf16:column,1,1,serial,1,1,heuristic,invalid,invalid,false,false,1,tensorop,f32,128,128,64,1,1,1,0,0,0,4,2,2,1,16,8,16,80,1024,469762048,1099645845504,2340,4.93251,88.6973,222939
1,CUTLASS,gemm,cutlass_tensorop_h16816gemm_s8_f16_128x128_64x4_tn_align16,passed,success,universal,8192,8192,8192,s8:row,f16:column,f16:column,f16:column,1,1,serial,1,1,heuristic,invalid,invalid,false,false,1,tensorop,f16,128,128,64,1,1,1,0,0,0,4,2,2,1,16,8,16,80,1024,469762048,1099645845504,2340,3.27055,133.769,336226
1,CUTLASS,gemm,cutlass_tensorop_h16816gemm_u8_f16_128x128_64x4_tn_align16,passed,success,universal,8192,8192,8192,u8:row,f16:column,f16:column,f16:column,1,1,serial,1,1,heuristic,invalid,invalid,false,false,1,tensorop,f16,128,128,64,1,1,1,0,0,0,4,2,2,1,16,8,16,80,1024,469762048,1099645845504,2340,3.14153,139.263,350035
1,CUTLASS,gemm,cutlass_tensorop_s16816gemm_f16_s8_128x128_64x4_tn_align16,passed,success,universal,8192,8192,8192,f16:row,s8:column,f32:column,f32:column,1,1,serial,1,1,heuristic,invalid,invalid,false,false,1,tensorop,f32,128,128,64,1,1,1,0,0,0,4,2,2,1,16,8,16,80,1024,738197504,1099645845504,1489,4.95841,138.653,221774
1,CUTLASS,gemm,cutlass_tensorop_f16_s16816gemm_f16_s8_128x128_64x4_tn_align16,passed,success,universal,8192,8192,8192,f16:row,s8:column,f16:column,f16:column,1,1,serial,1,1,heuristic,invalid,invalid,false,false,1,tensorop,f32,128,128,64,1,1,1,0,0,0,4,2,2,1,16,8,16,80,1024,469762048,1099645845504,2340,4.94572,88.4604,222343
1,CUTLASS,gemm,cutlass_tensorop_s16816gemm_f16_u8_128x128_64x4_tn_align16,passed,success,universal,8192,8192,8192,f16:row,u8:column,f32:column,f32:column,1,1,serial,1,1,heuristic,invalid,invalid,false,false,1,tensorop,f32,128,128,64,1,1,1,0,0,0,4,2,2,1,16,8,16,80,1024,738197504,1099645845504,1489,4.86604,141.285,225984
1,CUTLASS,gemm,cutlass_tensorop_f16_s16816gemm_f16_u8_128x128_64x4_tn_align16,passed,success,universal,8192,8192,8192,f16:row,u8:column,f16:column,f16:column,1,1,serial,1,1,heuristic,invalid,invalid,false,false,1,tensorop,f32,128,128,64,1,1,1,0,0,0,4,2,2,1,16,8,16,80,1024,469762048,1099645845504,2340,4.85427,90.1268,226532
1,CUTLASS,gemm,cutlass_tensorop_s16816gemm_bf16_s8_128x128_64x4_tn_align16,passed,success,universal,8192,8192,8192,bf16:row,s8:column,f32:column,f32:column,1,1,serial,1,1,heuristic,invalid,invalid,false,false,1,tensorop,f32,128,128,64,1,1,1,0,0,0,4,2,2,1,16,8,16,80,1024,738197504,1099645845504,1489,5.09194,135.017,215958
1,CUTLASS,gemm,cutlass_tensorop_bf16_s16816gemm_bf16_s8_128x128_64x4_tn_align16,passed,success,universal,8192,8192,8192,bf16:row,s8:column,bf16:column,bf16:column,1,1,serial,1,1,heuristic,invalid,invalid,false,false,1,tensorop,f32,128,128,64,1,1,1,0,0,0,4,2,2,1,16,8,16,80,1024,469762048,1099645845504,2340,5.07647,86.1819,216616
1,CUTLASS,gemm,cutlass_tensorop_s16816gemm_bf16_u8_128x128_64x4_tn_align16,passed,success,universal,8192,8192,8192,bf16:row,u8:column,f32:column,f32:column,1,1,serial,1,1,heuristic,invalid,invalid,false,false,1,tensorop,f32,128,128,64,1,1,1,0,0,0,4,2,2,1,16,8,16,80,1024,738197504,1099645845504,1489,5.10883,134.571,215244
1,CUTLASS,gemm,cutlass_tensorop_bf16_s16816gemm_bf16_u8_128x128_64x4_tn_align16,passed,success,universal,8192,8192,8192,bf16:row,u8:column,bf16:column,bf16:column,1,1,serial,1,1,heuristic,invalid,invalid,false,false,1,tensorop,f32,128,128,64,1,1,1,0,0,0,4,2,2,1,16,8,16,80,1024,469762048,1099645845504,2340,5.10165,85.7565,215547
1,CUTLASS,gemm,cutlass_tensorop_h16816gemm_f16_s8_128x128_64x4_tn_align16,passed,success,universal,8192,8192,8192,f16:row,s8:column,f16:column,f16:column,1,1,serial,1,1,heuristic,invalid,invalid,false,false,1,tensorop,f16,128,128,64,1,1,1,0,0,0,4,2,2,1,16,8,16,80,1024,469762048,1099645845504,2340,3.26892,133.836,336395
1,CUTLASS,gemm,cutlass_tensorop_h16816gemm_f16_u8_128x128_64x4_tn_align16,passed,success,universal,8192,8192,8192,f16:row,u8:column,f16:column,f16:column,1,1,serial,1,1,heuristic,invalid,invalid,false,false,1,tensorop,f16,128,128,64,1,1,1,0,0,0,4,2,2,1,16,8,16,80,1024,469762048,1099645845504,2340,3.13077,139.742,351238
1,CUTLASS,gemm,cutlass_tensorop_i16832gemm_s8_256x128_64x3_tn_align16,passed,success,universal,8192,8192,8192,s8:row,s8:column,s32:column,s32:column,1,1,serial,1,1,heuristic,invalid,invalid,false,false,1,tensorop,s32,256,128,64,1,1,1,0,0,0,3,4,2,1,16,8,32,80,1024,671088640,1099645845504,1638,1.54798,403.752,710374
1,CUTLASS,gemm,cutlass_tensorop_s8_i16832gemm_s8_256x128_64x3_tn_align16,passed,success,universal,8192,8192,8192,s8:row,s8:column,s8:column,s8:column,1,1,serial,1,1,heuristic,invalid,invalid,false,false,1,tensorop,s32,256,128,64,1,1,1,0,0,0,3,4,2,1,16,8,32,80,1024,268435456,1099645845504,4096,1.44548,172.954,760750
1,CUTLASS,gemm,cutlass_tensorop_i16832gemm_u8_256x128_64x3_tn_align16,passed,success,universal,8192,8192,8192,u8:row,u8:column,s32:column,s32:column,1,1,serial,1,1,heuristic,invalid,invalid,false,false,1,tensorop,s32,256,128,64,1,1,1,0,0,0,3,4,2,1,16,8,32,80,1024,671088640,1099645845504,1638,1.41351,442.161,777952
1,CUTLASS,gemm,cutlass_tensorop_u8_i16832gemm_u8_256x128_64x3_tn_align16,passed,success,universal,8192,8192,8192,u8:row,u8:column,u8:column,u8:column,1,1,serial,1,1,heuristic,invalid,invalid,false,false,1,tensorop,s32,256,128,64,1,1,1,0,0,0,3,4,2,1,16,8,32,80,1024,268435456,1099645845504,4096,1.30795,191.139,840741
1,CUTLASS,gemm,cutlass_tensorop_i16832gemm_s4_s8_256x128_64x3_tn_align32,passed,success,universal,8192,8192,8192,s4:row,s8:column,s32:column,s32:column,1,1,serial,1,1,heuristic,invalid,invalid,false,false,1,tensorop,s32,256,128,64,1,1,1,0,0,0,3,4,2,1,16,8,32,80,1024,637534208,1099645845504,1724,1.78933,331.828,614558
1,CUTLASS,gemm,cutlass_tensorop_s8_i16832gemm_s4_s8_256x128_64x3_tn_align32,passed,success,universal,8192,8192,8192,s4:row,s8:column,s8:column,s8:column,1,1,serial,1,1,heuristic,invalid,invalid,false,false,1,tensorop,s32,256,128,64,1,1,1,0,0,0,3,4,2,1,16,8,32,80,1024,234881024,1099645845504,4681,1.71632,127.453,640699
1,CUTLASS,gemm,cutlass_tensorop_i16832gemm_s8_s4_256x128_64x3_tn_align32,passed,success,universal,8192,8192,8192,s8:row,s4:column,s32:column,s32:column,1,1,serial,1,1,heuristic,invalid,invalid,false,false,1,tensorop,s32,256,128,64,1,1,1,0,0,0,3,4,2,1,16,8,32,80,1024,637534208,1099645845504,1724,1.78012,333.545,617736
1,CUTLASS,gemm,cutlass_tensorop_s8_i16832gemm_s8_s4_256x128_64x3_tn_align32,passed,success,universal,8192,8192,8192,s8:row,s4:column,s8:column,s8:column,1,1,serial,1,1,heuristic,invalid,invalid,false,false,1,tensorop,s32,256,128,64,1,1,1,0,0,0,3,4,2,1,16,8,32,80,1024,234881024,1099645845504,4681,1.6983,128.805,647498
1,CUTLASS,gemm,cutlass_tensorop_s8_i16832gemm_s8_256x128_64x3_n32t32_align16,not_verified,success,universal,8192,8192,8192,s8:nk32,s8:tk32,s8:nk32,s8:nk32,1,1,serial,1,1,heuristic,invalid,invalid,false,false,1,tensorop,s32,256,128,64,1,1,1,0,0,0,3,4,2,1,16,8,32,80,1024,268435456,1099645845504,4096,1.44722,172.745,759834
1,CUTLASS,gemm,cutlass_tensorop_u8_i16832gemm_u8_256x128_64x3_n32t32_align16,not_verified,success,universal,8192,8192,8192,u8:nk32,u8:tk32,u8:nk32,u8:nk32,1,1,serial,1,1,heuristic,invalid,invalid,false,false,1,tensorop,s32,256,128,64,1,1,1,0,0,0,3,4,2,1,16,8,32,80,1024,268435456,1099645845504,4096,1.32371,188.863,830731
1,CUTLASS,gemm,cutlass_tensorop_i16864gemm_s4_256x128_128x3_tn_align32,passed,success,universal,8192,8192,8192,s4:row,s4:column,s32:column,s32:column,1,1,serial,1,1,heuristic,invalid,invalid,false,false,1,tensorop,s32,256,128,128,1,1,1,0,0,0,3,4,2,1,16,8,64,80,1024,603979776,1099645845504,1820,12.2627,45.8708,89674.1
1,CUTLASS,gemm,cutlass_tensorop_s4_i16864gemm_s4_256x128_128x3_tn_align32,passed,success,universal,8192,8192,8192,s4:row,s4:column,s4:column,s4:column,1,1,serial,1,1,heuristic,invalid,invalid,false,false,1,tensorop,s32,256,128,128,1,1,1,0,0,0,3,4,2,1,16,8,64,80,1024,134217728,1099645845504,8193,11.8433,10.5545,92849.9
1,CUTLASS,gemm,cutlass_tensorop_i16864gemm_u4_256x128_128x3_tn_align32,passed,success,universal,8192,8192,8192,u4:row,u4:column,s32:column,s32:column,1,1,serial,1,1,heuristic,invalid,invalid,false,false,1,tensorop,s32,256,128,128,1,1,1,0,0,0,3,4,2,1,16,8,64,80,1024,603979776,1099645845504,1820,3.87645,145.107,283673
1,CUTLASS,gemm,cutlass_tensorop_u4_i16864gemm_u4_256x128_128x3_tn_align32,passed,success,universal,8192,8192,8192,u4:row,u4:column,u4:column,u4:column,1,1,serial,1,1,heuristic,invalid,invalid,false,false,1,tensorop,s32,256,128,128,1,1,1,0,0,0,3,4,2,1,16,8,64,80,1024,134217728,1099645845504,8193,3.81532,32.7627,288219
1,CUTLASS,gemm,cutlass_tensorop_s4_i16864gemm_s4_256x128_128x3_n64t64_align32,not_verified,success,universal,8192,8192,8192,s4:nk64,s4:tk64,s4:nk64,s4:nk64,1,1,serial,1,1,heuristic,invalid,invalid,false,false,1,tensorop,s32,256,128,128,1,1,1,0,0,0,3,4,2,1,16,8,64,80,1024,134217728,1099645845504,8193,11.8799,10.5219,92563.3
1,CUTLASS,gemm,cutlass_tensorop_u4_i16864gemm_u4_256x128_128x3_n64t64_align32,not_verified,success,universal,8192,8192,8192,u4:nk64,u4:tk64,u4:nk64,u4:nk64,1,1,serial,1,1,heuristic,invalid,invalid,false,false,1,tensorop,s32,256,128,128,1,1,1,0,0,0,3,4,2,1,16,8,64,80,1024,134217728,1099645845504,8193,3.71773,33.6226,295784
1,CUTLASS,gemm,cutlass_simt_sgemm_256x128_8x5_nn_align1,passed,success,universal,8192,8192,8192,f32:column,f32:column,f32:column,f32:column,1,1,serial,1,1,heuristic,invalid,invalid,false,false,1,simt,f32,256,128,8,1,1,1,0,0,0,5,4,2,1,1,1,1,50,1024,1073741824,1099645845504,1024,15.2154,65.7229,72271.9
1,CUTLASS,gemm,cutlass_simt_sgemm_256x128_8x5_nt_align1,passed,success,universal,8192,8192,8192,f32:column,f32:row,f32:column,f32:column,1,1,serial,1,1,heuristic,invalid,invalid,false,false,1,simt,f32,256,128,8,1,1,1,0,0,0,5,4,2,1,1,1,1,50,1024,1073741824,1099645845504,1024,14.5145,68.8967,75762
1,CUTLASS,gemm,cutlass_simt_sgemm_256x128_8x5_tn_align1,passed,success,universal,8192,8192,8192,f32:row,f32:column,f32:column,f32:column,1,1,serial,1,1,heuristic,invalid,invalid,false,false,1,simt,f32,256,128,8,1,1,1,0,0,0,5,4,2,1,1,1,1,50,1024,1073741824,1099645845504,1024,15.9372,62.7462,68998.6
1,CUTLASS,gemm,cutlass_simt_sgemm_256x128_8x5_tt_align1,passed,success,universal,8192,8192,8192,f32:row,f32:row,f32:column,f32:column,1,1,serial,1,1,heuristic,invalid,invalid,false,false,1,simt,f32,256,128,8,1,1,1,0,0,0,5,4,2,1,1,1,1,50,1024,1073741824,1099645845504,1024,14.8306,67.4283,74147.2
1,CUTLASS,gemm,cutlass_simt_dgemm_128x128_8x3_nn_align1,passed,success,universal,8192,8192,8192,f64:column,f64:column,f64:column,f64:column,1,1,serial,1,1,heuristic,invalid,invalid,false,false,1,simt,f64,128,128,8,1,1,1,0,0,0,3,4,2,1,1,1,1,50,1024,2147483648,1099645845504,512,578.839,3.45519,1899.74
1,CUTLASS,gemm,cutlass_simt_dgemm_128x128_8x3_nt_align1,passed,success,universal,8192,8192,8192,f64:column,f64:row,f64:column,f64:column,1,1,serial,1,1,heuristic,invalid,invalid,false,false,1,simt,f64,128,128,8,1,1,1,0,0,0,3,4,2,1,1,1,1,50,1024,2147483648,1099645845504,512,579.151,3.45333,1898.72
1,CUTLASS,gemm,cutlass_simt_dgemm_128x128_8x3_tn_align1,passed,success,universal,8192,8192,8192,f64:row,f64:column,f64:column,f64:column,1,1,serial,1,1,heuristic,invalid,invalid,false,false,1,simt,f64,128,128,8,1,1,1,0,0,0,3,4,2,1,1,1,1,50,1024,2147483648,1099645845504,512,579.761,3.4497,1896.72
1,CUTLASS,gemm,cutlass_simt_dgemm_128x128_8x3_tt_align1,passed,success,universal,8192,8192,8192,f64:row,f64:row,f64:column,f64:column,1,1,serial,1,1,heuristic,invalid,invalid,false,false,1,simt,f64,128,128,8,1,1,1,0,0,0,3,4,2,1,1,1,1,50,1024,2147483648,1099645845504,512,579.734,3.44986,1896.81
1,CUTLASS,gemm,cutlass_simt_cgemm_128x128_8x5_nn_align1,passed,success,universal,8192,8192,8192,cf32:column,cf32:column,cf32:column,cf32:column,1,1,serial,1,1,heuristic,invalid,invalid,false,false,1,simt,cf32,128,128,8,1,1,1,0,0,0,5,4,2,1,1,1,1,50,1024,2147483648,4398583382016,2048,52.7223,37.9346,83429.3
1,CUTLASS,gemm,cutlass_simt_cgemm_128x128_8x5_cn_align1,passed,success,universal,8192,8192,8192,cf32:column,cf32:column,cf32:column,cf32:column,1,1,serial,1,1,heuristic,invalid,invalid,false,false,1,simt,cf32,128,128,8,1,1,1,0,0,0,5,4,2,1,1,1,1,50,1024,2147483648,4398583382016,2048,59.7143,33.4928,73660.4
1,CUTLASS,gemm,cutlass_simt_cgemm_128x128_8x5_nc_align1,passed,success,universal,8192,8192,8192,cf32:column,cf32:column,cf32:column,cf32:column,1,1,serial,1,1,heuristic,invalid,invalid,false,false,1,simt,cf32,128,128,8,1,1,1,0,0,0,5,4,2,1,1,1,1,50,1024,2147483648,4398583382016,2048,54.6387,36.6041,80503.1
1,CUTLASS,gemm,cutlass_simt_cgemm_128x128_8x5_cc_align1,passed,success,universal,8192,8192,8192,cf32:column,cf32:column,cf32:column,cf32:column,1,1,serial,1,1,heuristic,invalid,invalid,false,false,1,simt,cf32,128,128,8,1,1,1,0,0,0,5,4,2,1,1,1,1,50,1024,2147483648,4398583382016,2048,61.921,32.2992,71035.4
1,CUTLASS,gemm,cutlass_simt_cgemm_128x128_8x5_nt_align1,passed,success,universal,8192,8192,8192,cf32:column,cf32:row,cf32:column,cf32:column,1,1,serial,1,1,heuristic,invalid,invalid,false,false,1,simt,cf32,128,128,8,1,1,1,0,0,0,5,4,2,1,1,1,1,50,1024,2147483648,4398583382016,2048,52.2362,38.2876,84205.7
1,CUTLASS,gemm,cutlass_simt_cgemm_128x128_8x5_ct_align1,passed,success,universal,8192,8192,8192,cf32:column,cf32:row,cf32:column,cf32:column,1,1,serial,1,1,heuristic,invalid,invalid,false,false,1,simt,cf32,128,128,8,1,1,1,0,0,0,5,4,2,1,1,1,1,50,1024,2147483648,4398583382016,2048,59.0861,33.8489,74443.6
1,CUTLASS,gemm,cutlass_simt_cgemm_128x128_8x5_nh_align1,passed,success,universal,8192,8192,8192,cf32:column,cf32:row,cf32:column,cf32:column,1,1,serial,1,1,heuristic,invalid,invalid,false,false,1,simt,cf32,128,128,8,1,1,1,0,0,0,5,4,2,1,1,1,1,50,1024,2147483648,4398583382016,2048,54.1008,36.968,81303.5
1,CUTLASS,gemm,cutlass_simt_cgemm_128x128_8x5_ch_align1,passed,success,universal,8192,8192,8192,cf32:column,cf32:row,cf32:column,cf32:column,1,1,serial,1,1,heuristic,invalid,invalid,false,false,1,simt,cf32,128,128,8,1,1,1,0,0,0,5,4,2,1,1,1,1,50,1024,2147483648,4398583382016,2048,61.7846,32.3705,71192.3
1,CUTLASS,gemm,cutlass_simt_cgemm_128x128_8x5_tn_align1,passed,success,universal,8192,8192,8192,cf32:row,cf32:column,cf32:column,cf32:column,1,1,serial,1,1,heuristic,invalid,invalid,false,false,1,simt,cf32,128,128,8,1,1,1,0,0,0,5,4,2,1,1,1,1,50,1024,2147483648,4398583382016,2048,53.7382,37.2175,81852.1
1,CUTLASS,gemm,cutlass_simt_cgemm_128x128_8x5_hn_align1,passed,success,universal,8192,8192,8192,cf32:row,cf32:column,cf32:column,cf32:column,1,1,serial,1,1,heuristic,invalid,invalid,false,false,1,simt,cf32,128,128,8,1,1,1,0,0,0,5,4,2,1,1,1,1,50,1024,2147483648,4398583382016,2048,61.6634,32.4341,71332.1
1,CUTLASS,gemm,cutlass_simt_cgemm_128x128_8x5_tc_align1,passed,success,universal,8192,8192,8192,cf32:row,cf32:column,cf32:column,cf32:column,1,1,serial,1,1,heuristic,invalid,invalid,false,false,1,simt,cf32,128,128,8,1,1,1,0,0,0,5,4,2,1,1,1,1,50,1024,2147483648,4398583382016,2048,56.3817,35.4725,78014.3
1,CUTLASS,gemm,cutlass_simt_cgemm_128x128_8x5_hc_align1,passed,success,universal,8192,8192,8192,cf32:row,cf32:column,cf32:column,cf32:column,1,1,serial,1,1,heuristic,invalid,invalid,false,false,1,simt,cf32,128,128,8,1,1,1,0,0,0,5,4,2,1,1,1,1,50,1024,2147483648,4398583382016,2048,62.8518,31.8209,69983.4
1,CUTLASS,gemm,cutlass_simt_cgemm_128x128_8x5_tt_align1,passed,success,universal,8192,8192,8192,cf32:row,cf32:row,cf32:column,cf32:column,1,1,serial,1,1,heuristic,invalid,invalid,false,false,1,simt,cf32,128,128,8,1,1,1,0,0,0,5,4,2,1,1,1,1,50,1024,2147483648,4398583382016,2048,53.1125,37.6559,82816.3
1,CUTLASS,gemm,cutlass_simt_cgemm_128x128_8x5_ht_align1,passed,success,universal,8192,8192,8192,cf32:row,cf32:row,cf32:column,cf32:column,1,1,serial,1,1,heuristic,invalid,invalid,false,false,1,simt,cf32,128,128,8,1,1,1,0,0,0,5,4,2,1,1,1,1,50,1024,2147483648,4398583382016,2048,60.4298,33.0962,72788.3
1,CUTLASS,gemm,cutlass_simt_cgemm_128x128_8x5_th_align1,passed,success,universal,8192,8192,8192,cf32:row,cf32:row,cf32:column,cf32:column,1,1,serial,1,1,heuristic,invalid,invalid,false,false,1,simt,cf32,128,128,8,1,1,1,0,0,0,5,4,2,1,1,1,1,50,1024,2147483648,4398583382016,2048,55.1352,36.2745,79778.1
1,CUTLASS,gemm,cutlass_simt_cgemm_128x128_8x5_hh_align1,passed,success,universal,8192,8192,8192,cf32:row,cf32:row,cf32:column,cf32:column,1,1,serial,1,1,heuristic,invalid,invalid,false,false,1,simt,cf32,128,128,8,1,1,1,0,0,0,5,4,2,1,1,1,1,50,1024,2147483648,4398583382016,2048,62.218,32.145,70696.3
1,CUTLASS,gemm,cutlass3x_sm120_sptensorop_spgemm_e2m1_e2m1_f32_f16_e4m3_128x128x256_1x1x1_0_tnt_align256_q,passed,success,universal,8192,8192,8192,fe2m1:row,fe2m1:column,f16:row,fe4m3:row,1,1,serial,1,1,heuristic,invalid,invalid,false,false,1,sptensorop,f32,128,128,256,1,1,1,0,0,0,0,4,2,1,16,8,64,120,120,335544320,1099645845504,3277,1.43236,218.171,767715
1,CUTLASS,gemm,cutlass3x_sm120_sptensorop_spgemm_e2m1_e3m2_f32_f16_e4m3_128x128x256_1x1x1_0_tnt_align256_q,passed,success,universal,8192,8192,8192,fe2m1:row,fe3m2:column,f16:row,fe4m3:row,1,1,serial,1,1,heuristic,invalid,invalid,false,false,1,sptensorop,f32,128,128,256,1,1,1,0,0,0,0,4,2,1,16,8,64,120,120,352321536,1099645845504,3121,1.34963,243.122,814775
1,CUTLASS,gemm,cutlass3x_sm120_sptensorop_spgemm_e2m1_e4m3_f32_f16_e4m3_128x128x256_1x1x1_0_tnt_align256_q,passed,success,universal,8192,8192,8192,fe2m1:row,fe4m3:column,f16:row,fe4m3:row,1,1,serial,1,1,heuristic,invalid,invalid,false,false,1,sptensorop,f32,128,128,256,1,1,1,0,0,0,0,4,2,1,16,8,64,120,120,369098752,1099645845504,2979,1.37083,250.761,802176
1,CUTLASS,gemm,cutlass3x_sm120_sptensorop_spgemm_e3m2_e2m1_f32_f16_e4m3_128x128x256_1x1x1_0_tnt_align256_q,passed,success,universal,8192,8192,8192,fe3m2:row,fe2m1:column,f16:row,fe4m3:row,1,1,serial,1,1,heuristic,invalid,invalid,false,false,1,sptensorop,f32,128,128,256,1,1,1,0,0,0,0,4,2,1,16,8,64,120,120,352321536,1099645845504,3121,1.42039,231.01,774186
1,CUTLASS,gemm,cutlass3x_sm120_sptensorop_spgemm_e3m2_e3m2_f32_f16_e4m3_128x128x256_1x1x1_0_tnt_align256_q,passed,success,universal,8192,8192,8192,fe3m2:row,fe3m2:column,f16:row,fe4m3:row,1,1,serial,1,1,heuristic,invalid,invalid,false,false,1,sptensorop,f32,128,128,256,1,1,1,0,0,0,0,4,2,1,16,8,64,120,120,369098752,1099645845504,2979,1.28778,266.932,853907
1,CUTLASS,gemm,cutlass3x_sm120_sptensorop_spgemm_e3m2_e4m3_f32_f16_e4m3_128x128x256_1x1x1_0_tnt_align256_q,passed,success,universal,8192,8192,8192,fe3m2:row,fe4m3:column,f16:row,fe4m3:row,1,1,serial,1,1,heuristic,invalid,invalid,false,false,1,sptensorop,f32,128,128,256,1,1,1,0,0,0,0,4,2,1,16,8,64,120,120,385875968,1099645845504,2849,1.30621,275.127,841857
1,CUTLASS,gemm,cutlass3x_sm120_sptensorop_spgemm_e4m3_e2m1_f32_f16_e4m3_128x128x256_1x1x1_0_tnt_align256_q,passed,success,universal,8192,8192,8192,fe4m3:row,fe2m1:column,f16:row,fe4m3:row,1,1,serial,1,1,heuristic,invalid,invalid,false,false,1,sptensorop,f32,128,128,256,1,1,1,0,0,0,0,4,2,1,16,8,64,120,120,369098752,1099645845504,2979,1.48204,231.945,741984
1,CUTLASS,gemm,cutlass3x_sm120_sptensorop_spgemm_e4m3_e3m2_f32_f16_e4m3_128x128x256_1x1x1_0_tnt_align256_q,passed,success,universal,8192,8192,8192,fe4m3:row,fe3m2:column,f16:row,fe4m3:row,1,1,serial,1,1,heuristic,invalid,invalid,false,false,1,sptensorop,f32,128,128,256,1,1,1,0,0,0,0,4,2,1,16,8,64,120,120,385875968,1099645845504,2849,1.30017,276.406,845771
1,CUTLASS,gemm,cutlass3x_sm120_sptensorop_spgemm_e4m3_e4m3_f32_f16_e4m3_128x128x256_1x1x1_0_tnt_align256_q,passed,success,universal,8192,8192,8192,fe4m3:row,fe4m3:column,f16:row,fe4m3:row,1,1,serial,1,1,heuristic,invalid,invalid,false,false,1,sptensorop,f32,128,128,256,1,1,1,0,0,0,0,4,2,1,16,8,64,120,120,402653184,1099645845504,2731,1.33489,280.923,823775
